Base Price,Price Tax Included,Name,Supplier,Image URL,Url
40.05,1,"Algorytmy i struktury danych. Kurs video. Java, JavaScript, Python",Artur Kulesza,https://static01.helion.com.pl/global/okladki/145x218/valgor.png,"https://helion.pl/ksiazki/algorytmy-i-struktury-danych-kurs-video-java-javascript-python-artur-kulesza,valgor.htm#format/w"
89.55,1,Microsoft SQL Server. Kurs video. Tworzenie zaawansowanych zapytań,Bartosz Szmit,https://static01.helion.com.pl/global/okladki/145x218/vsqlsz.png,"https://helion.pl/ksiazki/microsoft-sql-server-kurs-video-tworzenie-zaawansowanych-zapytan-bartosz-szmit,vsqlsz.htm#format/w"
98.45,1,Data Science w Pythonie. Kurs video. Algorytmy uczenia maszynowego,Oleg Żero,https://static01.helion.com.pl/global/okladki/145x218/vdascp.png,"https://helion.pl/ksiazki/data-science-w-pythonie-kurs-video-algorytmy-uczenia-maszynowego-oleg-zero,vdascp.htm#format/w"
99.60,1,Power Query i Power Pivot. Kurs video. Poznaj narzędzia Excel BI,Marcin Paluszkiewicz,https://static01.helion.com.pl/global/okladki/145x218/vpoweq.png,"https://helion.pl/ksiazki/power-query-i-power-pivot-kurs-video-poznaj-narzedzia-excel-bi-marcin-paluszkiewicz,vpoweq.htm#format/w"
26.55,1,Frontend developer. Kurs video. HTML i CSS. Poziom podstawowy,Radosław Madecki,https://static01.helion.com.pl/global/okladki/145x218/vpohtm.png,"https://helion.pl/ksiazki/frontend-developer-kurs-video-html-i-css-poziom-podstawowy-radoslaw-madecki,vpohtm.htm#format/w"
17.95,1,Python dla dzieci i młodzieży. Kurs video. Jak uczyć się programowania - pierwsze kroki,Zofia Matusiewicz,https://static01.helion.com.pl/global/okladki/145x218/vpytsz.png,"https://helion.pl/ksiazki/python-dla-dzieci-i-mlodziezy-kurs-video-jak-uczyc-sie-programowania-pierwsze-kroki-zofia-matusiewicz,vpytsz.htm#format/w"
134.55,1,Power BI Desktop. Kurs video. Wykorzystanie narzędzia w analizie i wizualizacji danych,Marcin Paluszkiewicz,https://static01.helion.com.pl/global/okladki/145x218/vpodpy.png,"https://helion.pl/ksiazki/power-bi-desktop-kurs-video-wykorzystanie-narzedzia-w-analizie-i-wizualizacji-danych-marcin-paluszkiewicz,vpodpy.htm#format/w"
15.96,1,Excel - tabele przestawne. Kurs video. Raporty i analiza danych,Adam Kopeć,https://static01.helion.com.pl/global/okladki/145x218/vex13t.png,"https://helion.pl/ksiazki/excel-tabele-przestawne-kurs-video-raporty-i-analiza-danych-adam-kopec,vex13t.htm#format/w"
53.55,1,Kubernetes. Kurs video. Wdrażanie aplikacji,Michał Żyłowski,https://static01.helion.com.pl/global/okladki/145x218/vuruap.png,"https://helion.pl/ksiazki/kubernetes-kurs-video-wdrazanie-aplikacji-michal-zylowski,vuruap.htm#format/w"
99.50,1,Machine Learning i język Python. Kurs video. Praktyczne wykorzystanie popularnych bibliotek,Piotr Szajowski,https://static01.helion.com.pl/global/okladki/145x218/vprwyp.png,"https://helion.pl/ksiazki/machine-learning-i-jezyk-python-kurs-video-praktyczne-wykorzystanie-popularnych-bibliotek-piotr-szajowski,vprwyp.htm#format/w"
26.55,1,Frontend developer. Kurs video. JavaScript. Poziom podstawowy,Radosław Madecki,https://static01.helion.com.pl/global/okladki/145x218/vpodjs.png,"https://helion.pl/ksiazki/frontend-developer-kurs-video-javascript-poziom-podstawowy-radoslaw-madecki,vpodjs.htm#format/w"
40.05,1,Frontend developer. Kurs video. JavaScript. Poziom średnio zaawansowany,Radosław Madecki,https://static01.helion.com.pl/global/okladki/145x218/vfrdes.png,"https://helion.pl/ksiazki/frontend-developer-kurs-video-javascript-poziom-srednio-zaawansowany-radoslaw-madecki,vfrdes.htm#format/w"
67.05,1,Podstawy Pythona z Minecraftem. Kurs video. Piszemy pierwsze skrypty,Tomasz Kaniecki,https://static01.helion.com.pl/global/okladki/145x218/vpypmi.png,"https://helion.pl/ksiazki/podstawy-pythona-z-minecraftem-kurs-video-piszemy-pierwsze-skrypty-tomasz-kaniecki,vpypmi.htm#format/w"
40.05,1,Microsoft Windows Server 2019. Kurs video. Zostań administratorem sieci,Jacek Mielnik,https://static01.helion.com.pl/global/okladki/145x218/vwis19.png,"https://helion.pl/ksiazki/microsoft-windows-server-2019-kurs-video-zostan-administratorem-sieci-jacek-mielnik,vwis19.htm#format/w"
26.55,1,Git. Kurs video. Pracuj wygodnie z najpopularniejszym systemem kontroli wersji,Marcin Biegała,https://static01.helion.com.pl/global/okladki/145x218/vgitv.png,"https://helion.pl/ksiazki/git-kurs-video-pracuj-wygodnie-z-najpopularniejszym-systemem-kontroli-wersji-marcin-biegala,vgitv.htm#format/w"
44.50,1,Frontend developer. Kurs video. HTML i CSS. Poziom średnio zaawansowany,Radosław Madecki,https://static01.helion.com.pl/global/okladki/145x218/vfrond.png,"https://helion.pl/ksiazki/frontend-developer-kurs-video-html-i-css-poziom-srednio-zaawansowany-radoslaw-madecki,vfrond.htm#format/w"
84.50,1,Microsoft Azure. Kurs video. Zostań administratorem systemów IT,Piotr Tenyszyn,https://static01.helion.com.pl/global/okladki/145x218/vmsazu.png,"https://helion.pl/ksiazki/microsoft-azure-kurs-video-zostan-administratorem-systemow-it-piotr-tenyszyn,vmsazu.htm#format/w"
395.00,1,Cisco CCNA 200-301. Kurs video. Podstawy sieci komputerowych i konfiguracji. Część 1,Adam Józefiok,https://static01.helion.com.pl/global/okladki/145x218/vcccpo.png,"https://helion.pl/ksiazki/cisco-ccna-200-301-kurs-video-podstawy-sieci-komputerowych-i-konfiguracji-czesc-1-adam-jozefiok,vcccpo.htm#format/w"
29.50,1,React. Pierwsze kroki. Kurs video. Tworzenie praktycznej aplikacji,Jakub Ciosłowski,https://static01.helion.com.pl/global/okladki/145x218/reactk.png,"https://helion.pl/ksiazki/react-pierwsze-kroki-kurs-video-tworzenie-praktycznej-aplikacji-jakub-cioslowski,reactk.htm#format/w"
76.05,1,Bash. Techniki zaawansowane. Kurs video. Zostań administratorem systemów IT,Piotr Kośka,https://static01.helion.com.pl/global/okladki/145x218/vbashz.png,"https://helion.pl/ksiazki/bash-techniki-zaawansowane-kurs-video-zostan-administratorem-systemow-it-piotr-koska,vbashz.htm#format/w"
39.90,1,Node.js i TypeScript. Kurs video. Tworzenie skalowalnych mikroserwisów,Sebastian Domagała,https://static01.helion.com.pl/global/okladki/145x218/vnodej.png,"https://helion.pl/ksiazki/node-js-i-typescript-kurs-video-tworzenie-skalowalnych-mikroserwisow-sebastian-domagala,vnodej.htm#format/w"
34.50,1,Linux. Kurs video. Wprowadzenie do pracy z konsolą,Piotr Chudzik,https://static01.helion.com.pl/global/okladki/145x218/vlinko.png,"https://helion.pl/ksiazki/linux-kurs-video-wprowadzenie-do-pracy-z-konsola-piotr-chudzik,vlinko.htm#format/w"
355.50,1,Cisco CCNA 200-301. Kurs video. Administrowanie bezpieczeństwem sieci. Część 3,Adam Józefiok,https://static01.helion.com.pl/global/okladki/145x218/vcccab.png,"https://helion.pl/ksiazki/cisco-ccna-200-301-kurs-video-administrowanie-bezpieczenstwem-sieci-czesc-3-adam-jozefiok,vcccab.htm#format/w"
395.00,1,Cisco CCNA 200-301. Kurs video. Administrowanie urządzeniami Cisco. Część 2,Adam Józefiok,https://static01.helion.com.pl/global/okladki/145x218/vcccau.png,"https://helion.pl/ksiazki/cisco-ccna-200-301-kurs-video-administrowanie-urzadzeniami-cisco-czesc-2-adam-jozefiok,vcccau.htm#format/w"
74.50,1,Data Science w Pythonie. Kurs video. Przetwarzanie i analiza danych,Oleg Żero,https://static01.helion.com.pl/global/okladki/145x218/vpyton.png,"https://helion.pl/ksiazki/data-science-w-pythonie-kurs-video-przetwarzanie-i-analiza-danych-oleg-zero,vpyton.htm#format/w"
26.55,1,Język C#. Kurs video. Poziom pierwszy. Programowanie dla początkujących,Anna Kempa,https://static01.helion.com.pl/global/okladki/145x218/vjcku1.png,"https://helion.pl/ksiazki/jezyk-c-kurs-video-poziom-pierwszy-programowanie-dla-poczatkujacych-anna-kempa,vjcku1.htm#format/w"
58.05,1,SQL. Kurs video. Od zera do bohatera. Odczytywanie danych,Marcin Szeliga,https://static01.helion.com.pl/global/okladki/145x218/vsqloz.png,"https://helion.pl/ksiazki/sql-kurs-video-od-zera-do-bohatera-odczytywanie-danych-marcin-szeliga,vsqloz.htm#format/w"
40.05,1,MikroTik. Kurs video. Przygotowanie do egzaminu MTCNA,Jacek Mielnik,https://static01.helion.com.pl/global/okladki/145x218/vmikro.png,"https://helion.pl/ksiazki/mikrotik-kurs-video-przygotowanie-do-egzaminu-mtcna-jacek-mielnik,vmikro.htm#format/w"
26.55,1,Python 3. Kurs video. Praktyczne wprowadzenie do programowania,Adam Bobowski,https://static01.helion.com.pl/global/okladki/145x218/vpytod.png,"https://helion.pl/ksiazki/python-3-kurs-video-praktyczne-wprowadzenie-do-programowania-adam-bobowski,vpytod.htm#format/w"
67.05,1,"Testy E2E. Kurs video. Protractor, Cypress, Cucumber",Dawid Perdek,https://static01.helion.com.pl/global/okladki/145x218/vrodop.png,"https://helion.pl/ksiazki/testy-e2e-kurs-video-protractor-cypress-cucumber-dawid-perdek,vrodop.htm#format/w"
58.05,1,Mikrotik. Kurs video. Przygotowanie do egzaminu MTCRE,Jacek Mielnik,https://static01.helion.com.pl/global/okladki/145x218/vmikti.png,"https://helion.pl/ksiazki/mikrotik-kurs-video-przygotowanie-do-egzaminu-mtcre-jacek-mielnik,vmikti.htm#format/w"
31.05,1,Poradnik hakera. Kurs video. Inżynieria odwrotna i modyfikacja programów komputerowych,Marcin Gomulak,https://static01.helion.com.pl/global/okladki/145x218/vpohak.png,"https://helion.pl/ksiazki/poradnik-hakera-kurs-video-inzynieria-odwrotna-i-modyfikacja-programow-komputerowych-marcin-gomulak,vpohak.htm#format/w"
34.50,1,Python. Kurs video. Poziom pierwszy. Podstawy programowania i tworzenia aplikacji,Joanna Zatorska,https://static01.helion.com.pl/global/okladki/145x218/vpytho.png,"https://helion.pl/ksiazki/python-kurs-video-poziom-pierwszy-podstawy-programowania-i-tworzenia-aplikacji-joanna-zatorska,vpytho.htm#format/w"
112.05,1,Twórz gry w Pythonie. Kurs video. Poznaj bibliotekę PyGame,Karol Kurek,https://static01.helion.com.pl/global/okladki/145x218/vpigry.png,"https://helion.pl/ksiazki/tworz-gry-w-pythonie-kurs-video-poznaj-biblioteke-pygame-karol-kurek,vpigry.htm#format/w"
49.50,1,Python 3. Kurs video. Kompendium efektywnego Pythonisty,Bartosz Zaczyński,https://static01.helion.com.pl/global/okladki/145x218/vpytpz.png,"https://helion.pl/ksiazki/python-3-kurs-video-kompendium-efektywnego-pythonisty-bartosz-zaczynski,vpytpz.htm#format/w"
34.50,1,Testy automatyczne kodu Python. Kurs video. Pisanie testów jednostkowych od podstaw,Jakub Wasielak,https://static01.helion.com.pl/global/okladki/145x218/vteskp.png,"https://helion.pl/ksiazki/testy-automatyczne-kodu-python-kurs-video-pisanie-testow-jednostkowych-od-podstaw-jakub-wasielak,vteskp.htm#format/w"
26.55,1,MySQL. Kurs video. Od podstaw do zagadnień zaawansowanych. Tworzenie i analizowanie baz danych,Przemysław Starosta,https://static01.helion.com.pl/global/okladki/145x218/vmysql.png,"https://helion.pl/ksiazki/mysql-kurs-video-od-podstaw-do-zagadnien-zaawansowanych-tworzenie-i-analizowanie-baz-danych-przemyslaw-starosta,vmysql.htm#format/w"
22.05,1,JavaScript. Kurs video. Poziom pierwszy. Programowanie interaktywnych stron internetowych,Jarosław Baca,https://static01.helion.com.pl/global/okladki/145x218/javscp.png,"https://helion.pl/ksiazki/javascript-kurs-video-poziom-pierwszy-programowanie-interaktywnych-stron-internetowych-jaroslaw-baca,javscp.htm#format/w"
26.55,1,"WordPress. Kurs video. Poziom pierwszy. Tworzenie, administracja i modyfikacja własnej witryny i bloga",Wojciech Bielak,https://static01.helion.com.pl/global/okladki/145x218/vwopre.png,"https://helion.pl/ksiazki/wordpress-kurs-video-poziom-pierwszy-tworzenie-administracja-i-modyfikacja-wlasnej-witryny-i-blog-wojciech-bielak,vwopre.htm#format/w"
35.55,1,MikroTik na start. Kurs video. Podstawy konfiguracji routera,Jacek Mielnik,https://static01.helion.com.pl/global/okladki/145x218/vmikst.png,"https://helion.pl/ksiazki/mikrotik-na-start-kurs-video-podstawy-konfiguracji-routera-jacek-mielnik,vmikst.htm#format/w"
15.60,1,PHP. Kurs video. Poziom drugi. Programowanie obiektowe w praktyce,Krzysztof Wołowski,https://static01.helion.com.pl/global/okladki/145x218/vphpp2.png,"https://helion.pl/ksiazki/php-kurs-video-poziom-drugi-programowanie-obiektowe-w-praktyce-krzysztof-wolowski,vphpp2.htm#format/w"
29.50,1,SQL. Kurs video. Od podstaw do zagadnień zaawansowanych. Tworzenie baz danych,Przemysław Starosta,https://static01.helion.com.pl/global/okladki/145x218/vsqlod.png,"https://helion.pl/ksiazki/sql-kurs-video-od-podstaw-do-zagadnien-zaawansowanych-tworzenie-baz-danych-przemyslaw-starosta,vsqlod.htm#format/w"
40.05,1,Microsoft Windows Server 2019. Kurs video. Nowoczesne administrowanie siecią,Jacek Mielnik,https://static01.helion.com.pl/global/okladki/145x218/vws19z.png,"https://helion.pl/ksiazki/microsoft-windows-server-2019-kurs-video-nowoczesne-administrowanie-siecia-jacek-mielnik,vws19z.htm#format/w"
24.50,1,SQL. Kurs video. Projektowanie i implementacja baz danych,Krzysztof Piaskowy,https://static01.helion.com.pl/global/okladki/145x218/vtwbzd.png,"https://helion.pl/ksiazki/sql-kurs-video-projektowanie-i-implementacja-baz-danych-krzysztof-piaskowy,vtwbzd.htm#format/w"
35.55,1,Python. Kurs video. Kreacyjne i strukturalne wzorce projektowe,Karol Kurek,https://static01.helion.com.pl/global/okladki/145x218/vwzpyt.png,"https://helion.pl/ksiazki/python-kurs-video-kreacyjne-i-strukturalne-wzorce-projektowe-karol-kurek,vwzpyt.htm#format/w"
64.50,1,Angular 11. Kurs video. Poznaj moc tworzenia aplikacji typu SPA,Rafał Słuja,https://static01.helion.com.pl/global/okladki/145x218/vangta.png,"https://helion.pl/ksiazki/angular-11-kurs-video-poznaj-moc-tworzenia-aplikacji-typu-spa-rafal-sluja,vangta.htm#format/w"
74.50,1,Google Cloud. Kurs video. Zostań administratorem systemów IT,Piotr Tenyszyn,https://static01.helion.com.pl/global/okladki/145x218/vgoclo.png,"https://helion.pl/ksiazki/google-cloud-kurs-video-zostan-administratorem-systemow-it-piotr-tenyszyn,vgoclo.htm#format/w"
34.50,1,Programowanie asynchroniczne i równoległe w C#. Kurs video. Poziom podstawowy,Jarosław Porwoł,https://static01.helion.com.pl/global/okladki/145x218/vasynp.png,"https://helion.pl/ksiazki/programowanie-asynchroniczne-i-rownolegle-w-c-kurs-video-poziom-podstawowy-jaroslaw-porwol,vasynp.htm#format/w"
26.55,1,Zostań programistą. Kurs video. Fundamentalne zasady i koncepcje programistyczne,Przemysław Starosta,https://static01.helion.com.pl/global/okladki/145x218/vzopro.png,"https://helion.pl/ksiazki/zostan-programista-kurs-video-fundamentalne-zasady-i-koncepcje-programistyczne-przemyslaw-starosta,vzopro.htm#format/w"
19.95,1,ASP.NET Core. Kurs video. Tworzenie REST Web API,Jakub Kozera,https://static01.helion.com.pl/global/okladki/145x218/vtwres.png,"https://helion.pl/ksiazki/asp-net-core-kurs-video-tworzenie-rest-web-api-jakub-kozera,vtwres.htm#format/w"
34.50,1,Wyrażenia regularne w Pythonie. Kurs video. Kompletne vademecum,Karol Kurek,https://static01.helion.com.pl/global/okladki/145x218/vwyrep.png,"https://helion.pl/ksiazki/wyrazenia-regularne-w-pythonie-kurs-video-kompletne-vademecum-karol-kurek,vwyrep.htm#format/w"
44.55,1,Python. Kurs video. Programowanie asynchroniczne,Karol Kurek,https://static01.helion.com.pl/global/okladki/145x218/vprasp.png,"https://helion.pl/ksiazki/python-kurs-video-programowanie-asynchroniczne-karol-kurek,vprasp.htm#format/w"
59.50,1,Docker. Kurs video. Zostań administratorem systemów IT,Piotr Tenyszyn,https://static01.helion.com.pl/global/okladki/145x218/vdockv.png,"https://helion.pl/ksiazki/docker-kurs-video-zostan-administratorem-systemow-it-piotr-tenyszyn,vdockv.htm#format/w"
35.55,1,Język C. Kurs video. Praktyczne wprowadzenie do programowania,Adam Bobowski,https://static01.helion.com.pl/global/okladki/145x218/vprojc.png,"https://helion.pl/ksiazki/jezyk-c-kurs-video-praktyczne-wprowadzenie-do-programowania-adam-bobowski,vprojc.htm#format/w"
59.50,1,C#. Kurs video. Zacznij programować obiektowo!,Marcin Szeliga,https://static01.helion.com.pl/global/okladki/145x218/vtprob.png,"https://helion.pl/ksiazki/c-kurs-video-zacznij-programowac-obiektowo-marcin-szeliga,vtprob.htm#format/w"
89.55,1,Bezpieczeństwo w ASP.NET Core. Kurs video. Podstawy kryptografii,Bartosz Szmit,https://static01.helion.com.pl/global/okladki/145x218/vbezpi.png,"https://helion.pl/ksiazki/bezpieczenstwo-w-asp-net-core-kurs-video-podstawy-kryptografii-bartosz-szmit,vbezpi.htm#format/w"
24.50,1,Keras w praktyce. Kurs video. Tworzenie modeli uczenia głębokiego,Radosław Słowiński,https://static01.helion.com.pl/global/okladki/145x218/vwdeel.png,"https://helion.pl/ksiazki/keras-w-praktyce-kurs-video-tworzenie-modeli-uczenia-glebokiego-radoslaw-slowinski,vwdeel.htm#format/w"
58.05,1,SQL. Kurs video. Od zera do bohatera. Modyfikowanie danych,Marcin Szeliga,https://static01.helion.com.pl/global/okladki/145x218/vsqlo2.png,"https://helion.pl/ksiazki/sql-kurs-video-od-zera-do-bohatera-modyfikowanie-danych-marcin-szeliga,vsqlo2.htm#format/w"
22.05,1,Linux. Kurs video. Komendy i polecenia,Daniel Deres,https://static01.helion.com.pl/global/okladki/145x218/vlinkp.png,"https://helion.pl/ksiazki/linux-kurs-video-komendy-i-polecenia-daniel-deres,vlinkp.htm#format/w"
67.60,1,Excel 2019 VBA. Kurs video. Opanuj podstawy i przećwicz je na 50 praktycznych przykładach,Daniel Brzózka,https://static01.helion.com.pl/global/okladki/145x218/vexpod.png,"https://helion.pl/ksiazki/excel-2019-vba-kurs-video-opanuj-podstawy-i-przecwicz-je-na-50-praktycznych-przykladach-daniel-brzozka,vexpod.htm#format/w"
51.60,1,Przetwarzanie danych w Excelu. Kurs video. Laboratorium Power Query,Marcin Cichocki,https://static01.helion.com.pl/global/okladki/145x218/vprzex.png,"https://helion.pl/ksiazki/przetwarzanie-danych-w-excelu-kurs-video-laboratorium-power-query-marcin-cichocki,vprzex.htm#format/w"
49.50,1,Automatyzacja zadań w Pythonie. Kurs video,Karol Kurek,https://static01.helion.com.pl/global/okladki/145x218/vautpr.png,"https://helion.pl/ksiazki/automatyzacja-zadan-w-pythonie-kurs-video-karol-kurek,vautpr.htm#format/w"
23.60,1,Excel 2013 i programowanie VBA. Kurs video. Poziom pierwszy. Tworzenie makr dla arkusza kalkulacyjnego,Jarosław Baca,https://static01.helion.com.pl/global/okladki/145x218/ve13v1.png,"https://helion.pl/ksiazki/excel-2013-i-programowanie-vba-kurs-video-poziom-pierwszy-tworzenie-makr-dla-arkusza-kalkulacyjneg-jaroslaw-baca,ve13v1.htm#format/w"
26.55,1,Od zera do frontend developera. Kurs video. Tworzenie stron w oparciu o HTML5 i CSS3,Michał Segieta,https://static01.helion.com.pl/global/okladki/145x218/vtwsin.png,"https://helion.pl/ksiazki/od-zera-do-frontend-developera-kurs-video-tworzenie-stron-w-oparciu-o-html5-i-css3-michal-segieta,vtwsin.htm#format/w"
58.05,1,Programowanie z GO. Kurs video. Podstawy języka,Tomasz Kaniecki,https://static01.helion.com.pl/global/okladki/145x218/vjezgo.png,"https://helion.pl/ksiazki/programowanie-z-go-kurs-video-podstawy-jezyka-tomasz-kaniecki,vjezgo.htm#format/w"
58.05,1,React Redux. Kurs video. Praktyczny przewodnik,Paweł Zagrobelny,https://static01.helion.com.pl/global/okladki/145x218/vredux.png,"https://helion.pl/ksiazki/react-redux-kurs-video-praktyczny-przewodnik-pawel-zagrobelny,vredux.htm#format/w"
44.50,1,Frontend Developer. Kurs video. Testowanie kodu w JavaScript,Radosław Madecki,https://static01.helion.com.pl/global/okladki/145x218/vfrdev.png,"https://helion.pl/ksiazki/frontend-developer-kurs-video-testowanie-kodu-w-javascript-radoslaw-madecki,vfrdev.htm#format/w"
89.55,1,Amazon Web Services (AWS). Kurs video. Zostań administratorem systemów IT,Piotr Kośka,https://static01.helion.com.pl/global/okladki/145x218/vawses.png,"https://helion.pl/ksiazki/amazon-web-services-aws-kurs-video-zostan-administratorem-systemow-it-piotr-koska,vawses.htm#format/w"
44.55,1,Ubuntu 20.04. Kurs video. Zostań administratorem systemów IT,Piotr Kośka,https://static01.helion.com.pl/global/okladki/145x218/vubun2.png,"https://helion.pl/ksiazki/ubuntu-20-04-kurs-video-zostan-administratorem-systemow-it-piotr-koska,vubun2.htm#format/w"
31.05,1,ASP .NET Core. Kurs video. Rozwijanie dodatkowych funkcjonalności Web API,Jakub Kozera,https://static01.helion.com.pl/global/okladki/145x218/vaspnc.png,"https://helion.pl/ksiazki/asp-net-core-kurs-video-rozwijanie-dodatkowych-funkcjonalnosci-web-api-jakub-kozera,vaspnc.htm#format/w"
17.95,1," T-SQL. Kurs video. Wykorzystanie baz danych przy użyciu niekonwencjonalnych rozwiązań. Sztuczki i gotowe rozwiązania",Przemysław Starosta,https://static01.helion.com.pl/global/okladki/145x218/vtsqls.png,"https://helion.pl/ksiazki/t-sql-kurs-video-wykorzystanie-baz-danych-przy-uzyciu-niekonwencjonalnych-rozwiazan-sztuczki-i-go-przemyslaw-starosta,vtsqls.htm#format/w"
199.00,1,Blockchain. Kurs video. Smart kontrakty i aplikacje zdecentralizowane w praktyce,Sylwester Wieczorkowski,https://static01.helion.com.pl/global/okladki/145x218/vblock.png,"https://helion.pl/ksiazki/blockchain-kurs-video-smart-kontrakty-i-aplikacje-zdecentralizowane-w-praktyce-sylwester-wieczorkowski,vblock.htm#format/w"
15.96,1,Excel - szybkie przetwarzanie danych. Sztuczki i gotowe rozwiązania. Kurs video,Daniel Brzózka,https://static01.helion.com.pl/global/okladki/145x218/vextr2.png,"https://helion.pl/ksiazki/excel-szybkie-przetwarzanie-danych-sztuczki-i-gotowe-rozwiazania-kurs-video-daniel-brzozka,vextr2.htm#format/w"
27.60,1,Excel 2016 i programowanie VBA. Kurs video. Poziom drugi. Zaawansowane techniki tworzenia makr,Jarosław Baca,https://static01.helion.com.pl/global/okladki/145x218/ve16v2.png,"https://helion.pl/ksiazki/excel-2016-i-programowanie-vba-kurs-video-poziom-drugi-zaawansowane-techniki-tworzenia-makr-jaroslaw-baca,ve16v2.htm#format/w"
29.50,1,Python. Kurs video. Wzorce czynnościowe i architektoniczne oraz antywzorce,Karol Kurek,https://static01.helion.com.pl/global/okladki/145x218/vwzpro.png,"https://helion.pl/ksiazki/python-kurs-video-wzorce-czynnosciowe-i-architektoniczne-oraz-antywzorce-karol-kurek,vwzpro.htm#format/w"
58.05,1,Poradnik hakera. Kurs video. Inżynieria odwrotna plików binarnych,Marcin Gomulak,https://static01.helion.com.pl/global/okladki/145x218/vporha.png,"https://helion.pl/ksiazki/poradnik-hakera-kurs-video-inzynieria-odwrotna-plikow-binarnych-marcin-gomulak,vporha.htm#format/w"
31.05,1,"Blender 2.71. Kurs video. Poziom pierwszy. Modelowanie w 3D, animacja i renderowanie",Marcin Strzempkowski,https://static01.helion.com.pl/global/okladki/145x218/blendp.png,"https://helion.pl/ksiazki/blender-2-71-kurs-video-poziom-pierwszy-modelowanie-w-3d-animacja-i-renderowanie-marcin-strzempkowski,blendp.htm#format/w"
31.05,1,GIMP 2.10. Kurs video. Obróbka fotografii i tworzenie grafik,Jarosław Baca,https://static01.helion.com.pl/global/okladki/145x218/vgi210.png,"https://helion.pl/ksiazki/gimp-2-10-kurs-video-obrobka-fotografii-i-tworzenie-grafik-jaroslaw-baca,vgi210.htm#format/w"
31.60,1,Excel 2019. Kurs video. Postaw pierwsze kroki!,Daniel Brzózka,https://static01.helion.com.pl/global/okladki/145x218/vex19p.png,"https://helion.pl/ksiazki/excel-2019-kurs-video-postaw-pierwsze-kroki-daniel-brzozka,vex19p.htm#format/w"
76.05,1,React Native. Kurs video. Zostań programistą aplikacji mobilnych,Sebastian Mysakowski,https://static01.helion.com.pl/global/okladki/145x218/vuczgl.png,"https://helion.pl/ksiazki/react-native-kurs-video-zostan-programista-aplikacji-mobilnych-sebastian-mysakowski,vuczgl.htm#format/w"
44.55,1,Angielski dla specjalistów IT. Kurs video. Level up,Anna Lewoc,https://static01.helion.com.pl/global/okladki/145x218/vanit2.png,"https://helion.pl/ksiazki/angielski-dla-specjalistow-it-kurs-video-level-up-anna-lewoc,vanit2.htm#format/w"
59.50,1,Angular 10. Kurs video. Budowa aplikacji od podstaw,Rafał Słuja,https://static01.helion.com.pl/global/okladki/145x218/vlara6.png,"https://helion.pl/ksiazki/angular-10-kurs-video-budowa-aplikacji-od-podstaw-rafal-sluja,vlara6.htm#format/w"
17.95,1,Ćwiczenia na bóle kręgosłupa i inne przypadłości osób przywiązanych do biurka. Kurs wideo,Anna Brzegowa,https://static01.helion.com.pl/global/okladki/145x218/vzescw.png,"https://helion.pl/ksiazki/cwiczenia-na-bole-kregoslupa-i-inne-przypadlosci-osob-przywiazanych-do-biurka-kurs-wideo-anna-brzegowa,vzescw.htm#format/w"
31.05,1,Wzorce projektowe dla programistów C#. Kurs video,Jacek Matulewski,https://static01.helion.com.pl/global/okladki/145x218/vwzprp.png,"https://helion.pl/ksiazki/wzorce-projektowe-dla-programistow-c-kurs-video-jacek-matulewski,vwzprp.htm#format/w"
134.55,1,Java Full Stack Developer. Kurs video. Tworzenie aplikacji internetowych od podstaw,Marcin Berendt,https://static01.helion.com.pl/global/okladki/145x218/vjavfu.png,"https://helion.pl/ksiazki/java-full-stack-developer-kurs-video-tworzenie-aplikacji-internetowych-od-podstaw-marcin-berendt,vjavfu.htm#format/w"
58.05,1,Git. Kurs video. Zaawansowane aspekty konfiguracji popularnego systemu kontroli wersji,Tomasz Trębski,https://static01.helion.com.pl/global/okladki/145x218/vkogiz.png,"https://helion.pl/ksiazki/git-kurs-video-zaawansowane-aspekty-konfiguracji-popularnego-systemu-kontroli-wersji-tomasz-trebski,vkogiz.htm#format/w"
53.55,1,React.js i Node.js. Kurs video. Budowanie serwisu w oparciu o popularne biblioteki języka JavaScript,Jakub Kukuryk,https://static01.helion.com.pl/global/okladki/145x218/vnodre.png,"https://helion.pl/ksiazki/react-js-i-node-js-kurs-video-budowanie-serwisu-w-oparciu-o-popularne-biblioteki-jezyka-javascript-jakub-kukuryk,vnodre.htm#format/w"
26.55,1,Język UML. Kurs video. Poziom pierwszy. Modelowanie systemów informatycznych,Marcin Albiniak,https://static01.helion.com.pl/global/okladki/145x218/vumlkv.png,"https://helion.pl/ksiazki/jezyk-uml-kurs-video-poziom-pierwszy-modelowanie-systemow-informatycznych-marcin-albiniak,vumlkv.htm#format/w"
34.50,1,Adobe Illustrator. Kurs video. Poziom pierwszy. Projektowanie grafiki wektorowej,Marcin Strzempkowski,https://static01.helion.com.pl/global/okladki/145x218/illusp.png,"https://helion.pl/ksiazki/adobe-illustrator-kurs-video-poziom-pierwszy-projektowanie-grafiki-wektorowej-marcin-strzempkowski,illusp.htm#format/w"
